link,pdf_link,title,doi
https://www.sciencedirect.com/science/article/pii/S2468502X24000226,https://www.sciencedirect.com/science/article/pii/S2468502X24000226/pdfft?md5=d535cfeb7d4bca4f8b918b02581ff6a3&pid=1-s2.0-S2468502X24000226-main.pdf,AVA: An automated and AI-driven intelligent visual analytics framework,https://doi.org/10.1016/j.visinf.2024.06.002
https://www.sciencedirect.com/science/article/pii/S0360131524002380,https://www.sciencedirect.com/science/article/pii/S0360131524002380/pdfft?md5=16997d165adca0bce16cf449f94ab79b&pid=1-s2.0-S0360131524002380-main.pdf,Does ChatGPT enhance student learning? A systematic review and meta-analysis of experimental studies,https://doi.org/10.1016/j.compedu.2024.105224
https://www.sciencedirect.com/science/article/pii/S0306437915001179,,Impact analysis and change propagation in service-oriented enterprises: A systematic review,https://doi.org/10.1016/j.is.2015.06.003
https://www.sciencedirect.com/science/article/pii/B9780443159916000170,,Chapter Eleven: Designing meaningful metrics to demonstrate ethical supervision of autonomous systems: How do you measure that?,https://doi.org/10.1016/B978-0-44-315991-6.00017-0
https://www.sciencedirect.com/science/article/pii/S0167814006810194,,Posters,https://doi.org/10.1016/S0167-8140(06)81019-4
https://www.sciencedirect.com/science/article/pii/S2307187724002177,https://www.sciencedirect.com/science/article/pii/S2307187724002177/pdfft?md5=29d6e1611fbb5c518a7f65cb35d6c0f7&pid=1-s2.0-S2307187724002177-main.pdf,The potential of LLMs in hardware design,https://doi.org/10.1016/j.jer.2024.08.001
https://www.sciencedirect.com/science/article/pii/S0950584925001193,,An empirical study on capability of Large Language Models in understanding code semantics,https://doi.org/10.1016/j.infsof.2025.107780
https://www.sciencedirect.com/science/article/pii/S0950705123010766,,On the effectiveness of graph data augmentation for source code learning,https://doi.org/10.1016/j.knosys.2023.111328
https://www.sciencedirect.com/science/article/pii/S0950584924002076,,E-code: Mastering efficient code generation through pretrained models and expert encoder group,https://doi.org/10.1016/j.infsof.2024.107602
https://www.sciencedirect.com/science/article/pii/S0950584925001259,https://www.sciencedirect.com/science/article/pii/S0950584925001259/pdfft?md5=e42759a506161c9494fba345e8382b15&pid=1-s2.0-S0950584925001259-main.pdf,Generating vulnerability security fixes with Code Language Models,https://doi.org/10.1016/j.infsof.2025.107786
https://www.sciencedirect.com/science/article/pii/S0950584925000618,https://www.sciencedirect.com/science/article/pii/S0950584925000618/pdfft?md5=f55810e9fc0931072891b72f8d4ed7e6&pid=1-s2.0-S0950584925000618-main.pdf,A systematic mapping study on graph machine learning for static source code analysis,https://doi.org/10.1016/j.infsof.2025.107722
https://www.sciencedirect.com/science/article/pii/S0164121225000524,https://www.sciencedirect.com/science/article/pii/S0164121225000524/pdfft?md5=131599722ed4043719df963620f78e16&pid=1-s2.0-S0164121225000524-main.pdf,Poisoned source code detection in code models,https://doi.org/10.1016/j.jss.2025.112384
https://www.sciencedirect.com/science/article/pii/S0164121223003369,,On the impact of multiple source code representations on software engineering tasks — An empirical study,https://doi.org/10.1016/j.jss.2023.111941
https://www.sciencedirect.com/science/article/pii/S1570826824000441,https://www.sciencedirect.com/science/article/pii/S1570826824000441/pdfft?md5=05f2c90d1a9b90c0531433fb64115234&pid=1-s2.0-S1570826824000441-main.pdf,Knowledge Graphs as a source of trust for LLM-powered enterprise question answering,https://doi.org/10.1016/j.websem.2024.100858
https://www.sciencedirect.com/science/article/pii/S2162098924001178,https://www.sciencedirect.com/science/article/pii/S2162098924001178/pdfft?md5=0efb5252c5a21aba2fea02c1ccf688ca&pid=1-s2.0-S2162098924001178-main.pdf,Accuracy of large language models in answering ophthalmology board-style questions: A meta-analysis,https://doi.org/10.1016/j.apjo.2024.100106
https://www.sciencedirect.com/science/article/pii/S2666920X25000578,https://www.sciencedirect.com/science/article/pii/S2666920X25000578/pdfft?md5=ecf8c7c2b7404daa031b951d26e5b8aa&pid=1-s2.0-S2666920X25000578-main.pdf,Retrieval-augmented generation for educational application: A systematic survey,https://doi.org/10.1016/j.caeai.2025.100417
https://www.sciencedirect.com/science/article/pii/S0927538X24003846,,Finance-specific large language models: Advancing sentiment analysis and return prediction with LLaMA 2,https://doi.org/10.1016/j.pacfin.2024.102632
https://www.sciencedirect.com/science/article/pii/S1532046424000388,https://www.sciencedirect.com/science/article/pii/S1532046424000388/pdfft?md5=5458319e1eb6602ccfde79a68117f6f2&pid=1-s2.0-S1532046424000388-main.pdf,Evaluation of ChatGPT-generated medical responses: A systematic review and meta-analysis,https://doi.org/10.1016/j.jbi.2024.104620
https://www.sciencedirect.com/science/article/pii/S0169260725002871,,Visual-language foundation models in medical imaging: A systematic review and meta-analysis of diagnostic and analytical applications,https://doi.org/10.1016/j.cmpb.2025.108870
https://www.sciencedirect.com/science/article/pii/S0020653925001479,https://www.sciencedirect.com/science/article/pii/S0020653925001479/pdfft?md5=a6595dbf4bdb50897399e2b19fadc715&pid=1-s2.0-S0020653925001479-main.pdf,AI-Powered Problem- and Case-based Learning in Medical and Dental Education: A Systematic Review and Meta-analysis,https://doi.org/10.1016/j.identj.2025.100858
https://www.sciencedirect.com/science/article/pii/S0048733323002019,https://www.sciencedirect.com/science/article/pii/S0048733323002019/pdfft?md5=52bffc65e05868551d05578ceba1f5fd&pid=1-s2.0-S0048733323002019-main.pdf,Epidemic effects in the diffusion of emerging digital technologies: evidence from artificial intelligence adoption,https://doi.org/10.1016/j.respol.2023.104917
https://www.sciencedirect.com/science/article/pii/S1936878X17305193,https://www.sciencedirect.com/science/article/pii/S1936878X17305193/pdfft?md5=f221c5728b164264f339cd44f5ea0a8f&pid=1-s2.0-S1936878X17305193-main.pdf,The Identification of Calcified Coronary Plaque Is Associated With Initiation and Continuation of Pharmacological and Lifestyle Preventive Therapies: A Systematic Review and Meta-Analysis,https://doi.org/10.1016/j.jcmg.2017.01.030
https://www.sciencedirect.com/science/article/pii/S0167494322001327,,Effects of multi-component non-pharmacological interventions on cognition in participants with mild cognitive impairment: A systematic review and meta-analysis,https://doi.org/10.1016/j.archger.2022.104751
https://www.sciencedirect.com/science/article/pii/S1929074825002719,,The Prevalence of Hypertension Among Children and Antihypertensive Use: Protocol for a Systematic Review and Meta-Analysis,https://doi.org/10.2196/65807
https://www.sciencedirect.com/science/article/pii/S0016508525049376,,Su1730: TRANSARTERIAL CHEMOEMBOLIZATION COMBINED WITH SORAFENIB VERSUS MONOTHERAPY FOR UNRESECTABLE HEPATOCELLULAR CARCINOMA: AN UMBRELLA REVIEW OF META-ANALYSES,https://doi.org/10.1016/S0016-5085(25)04937-6
https://www.sciencedirect.com/science/article/pii/S0957417424021572,,Software bug prediction using graph neural networks and graph-based text representations,https://doi.org/10.1016/j.eswa.2024.125290
https://www.sciencedirect.com/science/article/pii/S0950584924001484,,Automated description generation for software patches,https://doi.org/10.1016/j.infsof.2024.107543
https://www.sciencedirect.com/science/article/pii/S2589537025002020,https://www.sciencedirect.com/science/article/pii/S2589537025002020/pdfft?md5=69b634b7bf01f863c3c14faaec1055c3&pid=1-s2.0-S2589537025002020-main.pdf,Interventions to improve adherence to lipid-lowering drugs: a systematic review and meta-analysis,https://doi.org/10.1016/j.eclinm.2025.103270
https://www.sciencedirect.com/science/article/pii/S2666557325000084,https://www.sciencedirect.com/science/article/pii/S2666557325000084/pdfft?md5=1c6511e82cff2ecfb59d370ea944a561&pid=1-s2.0-S2666557325000084-main.pdf,The Impact of Generative AI on Essay Revisions and Student Engagement,https://doi.org/10.1016/j.caeo.2025.100249
https://www.sciencedirect.com/science/article/pii/S001650852403587X,,Tu1650 CHANGES IN ANTI-VINCULIN ANTIBODIES OVER TIME CORRELATE WITH SYMPTOM IMPROVEMENT IN IRRITABLE BOWEL SYDROME (IBS),https://doi.org/10.1016/S0016-5085(24)03587-X
https://www.sciencedirect.com/science/article/pii/S2949882125000465,https://www.sciencedirect.com/science/article/pii/S2949882125000465/pdfft?md5=1f0c902f355bbb07c130f500cd3bffa6&pid=1-s2.0-S2949882125000465-main.pdf,AI literacy and trust: A multi-method study of Human-GAI team collaboration,https://doi.org/10.1016/j.chbah.2025.100162
https://www.sciencedirect.com/science/article/pii/S2667325824001043,https://www.sciencedirect.com/science/article/pii/S2667325824001043/pdfft?md5=40bae6513c2c4be760a59d433b191409&pid=1-s2.0-S2667325824001043-main.pdf,A review of deep learning methods for ligand based drug virtual screening,https://doi.org/10.1016/j.fmre.2024.02.011
https://www.sciencedirect.com/science/article/pii/S0531556524002857,https://www.sciencedirect.com/science/article/pii/S0531556524002857/pdfft?md5=e98c499bacb9e551b04adf4d301fb483&pid=1-s2.0-S0531556524002857-main.pdf,"Lower extremity muscle hypertrophy in response to resistance training in older adults: Systematic review, meta-analysis, and meta-regression of randomized controlled trials",https://doi.org/10.1016/j.exger.2024.112639
https://www.sciencedirect.com/science/article/pii/S0735109724084572,https://www.sciencedirect.com/science/article/pii/S0735109724084572/pdfft?md5=0d679095aec680c0cedb3a37e10b995a&pid=1-s2.0-S0735109724084572-main.pdf,Artificial Intelligence in Cardiovascular Clinical Trials,https://doi.org/10.1016/j.jacc.2024.08.069
https://www.sciencedirect.com/science/article/pii/S1268773124002674,https://www.sciencedirect.com/science/article/pii/S1268773124002674/pdfft?md5=f0a3d70405e8b87dd4c7d0241a863e82&pid=1-s2.0-S1268773124002674-main.pdf,"Diagnosis, treatment, and prevention of ankle sprains: Comparing free chatbot recommendations with clinical guidelines",https://doi.org/10.1016/j.fas.2024.12.003
https://www.sciencedirect.com/science/article/pii/S095741742500288X,,NtNDet: Hardware Trojan detection based on pre-trained language models,https://doi.org/10.1016/j.eswa.2025.126666
https://www.sciencedirect.com/science/article/pii/S0164121224002462,,An intelligent test management system for optimizing decision making during software testing,https://doi.org/10.1016/j.jss.2024.112202
https://www.sciencedirect.com/science/article/pii/S1438887125002420,,Automated Process for Monitoring of Amiodarone Treatment: Development and Evaluation,https://doi.org/10.2196/65473
https://www.sciencedirect.com/science/article/pii/S1877050925003989,https://www.sciencedirect.com/science/article/pii/S1877050925003989/pdfft?md5=95c6d783628ea7f4961c001e1db363b7&pid=1-s2.0-S1877050925003989-main.pdf,Leveraging Personal Assistants for Enhanced Access to Cultural Knowledge: A Case Study,https://doi.org/10.1016/j.procs.2025.02.055
https://www.sciencedirect.com/science/article/pii/S2291969425000195,,Digital Representation of Patients as Medical Digital Twins: Data-Centric Viewpoint,https://doi.org/10.2196/53542
https://www.sciencedirect.com/science/article/pii/S0164121224000037,,Flexible control flow graph alignment for delivering data-driven feedback to novice programming learners,https://doi.org/10.1016/j.jss.2024.111960
https://www.sciencedirect.com/science/article/pii/S2949882123000221,https://www.sciencedirect.com/science/article/pii/S2949882123000221/pdfft?md5=f9aa184eb8668e5dbec672d9482aabfb&pid=1-s2.0-S2949882123000221-main.pdf,"ChatGPT in education: Methods, potentials, and limitations",https://doi.org/10.1016/j.chbah.2023.100022
https://www.sciencedirect.com/science/article/pii/S0167739X24004643,https://www.sciencedirect.com/science/article/pii/S0167739X24004643/pdfft?md5=fc9365c86570d800986a175631a6a13d&pid=1-s2.0-S0167739X24004643-main.pdf,"Cybersecurity for tactical 6G networks: Threats, architecture, and intelligence",https://doi.org/10.1016/j.future.2024.107500
https://www.sciencedirect.com/science/article/pii/S294976122400124X,https://www.sciencedirect.com/science/article/pii/S294976122400124X/pdfft?md5=d9487a0e7d6915f75193e73d2effc3ec&pid=1-s2.0-S294976122400124X-main.pdf,Global Harmonization of Artificial Intelligence-Enabled Software as a Medical Device Regulation: Addressing Challenges and Unifying Standards,https://doi.org/10.1016/j.mcpdig.2024.100191
https://www.sciencedirect.com/science/article/pii/S0306454924000604,,Machine learning at the edge to improve in-field safeguards inspections,https://doi.org/10.1016/j.anucene.2024.110398
https://www.sciencedirect.com/science/article/pii/S0167404824002931,https://www.sciencedirect.com/science/article/pii/S0167404824002931/pdfft?md5=a4b0427fd2f32dea4e959de2e314829e&pid=1-s2.0-S0167404824002931-main.pdf,Adversarial Machine Learning in Industry: A Systematic Literature Review,https://doi.org/10.1016/j.cose.2024.103988
https://www.sciencedirect.com/science/article/pii/S0167642325000565,,Testing non-commutativity of reduce functions with multi-column inputs,https://doi.org/10.1016/j.scico.2025.103317
https://www.sciencedirect.com/science/article/pii/S1389128625002270,,A model checking-based framework for testing security properties of protocols under development,https://doi.org/10.1016/j.comnet.2025.111259
https://www.sciencedirect.com/science/article/pii/S1877050924006306,https://www.sciencedirect.com/science/article/pii/S1877050924006306/pdfft?md5=0ab754addab1b8b10989377ccb28b2ff&pid=1-s2.0-S1877050924006306-main.pdf,BiT5: A Bidirectional NLP Approach for Advanced Vulnerability Detection in Codebase,https://doi.org/10.1016/j.procs.2024.03.270
https://www.sciencedirect.com/science/article/pii/S0164121224003649,,An empirical investigation into the capabilities of anomaly detection approaches for test smell detection,https://doi.org/10.1016/j.jss.2024.112320
https://www.sciencedirect.com/science/article/pii/S0164121224001821,,Impermanent identifiers: Enhanced source code comprehension and refactoring,https://doi.org/10.1016/j.jss.2024.112137
https://www.sciencedirect.com/science/article/pii/S0164121224001584,https://www.sciencedirect.com/science/article/pii/S0164121224001584/pdfft?md5=c7734d2003ab22f80edc9da32fb97026&pid=1-s2.0-S0164121224001584-main.pdf,Automating the correctness assessment of AI-generated code for security contexts,https://doi.org/10.1016/j.jss.2024.112113
https://www.sciencedirect.com/science/article/pii/S1084804524001978,,A survey on fuzz testing technologies for industrial control protocols,https://doi.org/10.1016/j.jnca.2024.104020
https://www.sciencedirect.com/science/article/pii/S1526149224001930,,C-CORE: Clustering by Code Representation to Prioritize Test Cases in Compiler Testing,https://doi.org/10.32604/cmes.2023.043248
https://www.sciencedirect.com/science/article/pii/S0950584922001070,,A deep learning-based automated framework for functional User Interface testing,https://doi.org/10.1016/j.infsof.2022.106969
https://www.sciencedirect.com/science/article/pii/S0957417422012908,,UISMiner: Mining UI suggestions from user reviews,https://doi.org/10.1016/j.eswa.2022.118095
https://www.sciencedirect.com/science/article/pii/S0920548924000722,,"Prototype, method, and experiment for evaluating usability of smart home user interfaces",https://doi.org/10.1016/j.csi.2024.103903
https://www.sciencedirect.com/science/article/pii/S0950584921001488,,Developing Mobile Applications Via Model Driven Development: A Systematic Literature Review,https://doi.org/10.1016/j.infsof.2021.106693
https://www.sciencedirect.com/science/article/pii/S0164121216300140,,A systematic mapping study of mobile application testing techniques,https://doi.org/10.1016/j.jss.2016.03.065
https://www.sciencedirect.com/science/article/pii/S0950584916301434,,Improving the delivery cycle: A multiple-case study of the toolchains in Finnish software intensive enterprises,https://doi.org/10.1016/j.infsof.2016.09.001
https://www.sciencedirect.com/science/article/pii/S0950584922001719,,A taxonomy of metrics for GUI-based testing research: A systematic literature review,https://doi.org/10.1016/j.infsof.2022.107062
https://www.sciencedirect.com/science/article/pii/S0950584913000669,,Graphical user interface (GUI) testing: Systematic mapping and repository,https://doi.org/10.1016/j.infsof.2013.03.004
https://www.sciencedirect.com/science/article/pii/S0164121219300779,,A systematic literature review on crowdsourcing in software engineering,https://doi.org/10.1016/j.jss.2019.04.027
https://www.sciencedirect.com/science/article/pii/S0957417421003419,,"Expert systems: Definitions, advantages and issues in medical field applications",https://doi.org/10.1016/j.eswa.2021.114900
https://www.sciencedirect.com/science/article/pii/S1574119222000591,https://www.sciencedirect.com/science/article/pii/S1574119222000591/pdfft?md5=2c9283e580e9bea5f6cd750c6c6cd920&pid=1-s2.0-S1574119222000591-main.pdf,Perses: A framework for the continuous evaluation of the QoS of distributed mobile applications,https://doi.org/10.1016/j.pmcj.2022.101627
https://www.sciencedirect.com/science/article/pii/S0167739X18310410,,On using collaborative economy for test cost reduction in high fragmented environments,https://doi.org/10.1016/j.future.2019.01.023
https://www.sciencedirect.com/science/article/pii/S0950584923002495,https://www.sciencedirect.com/science/article/pii/S0950584923002495/pdfft?md5=44ad4c76cc1ea46f4186223514d4f17f&pid=1-s2.0-S0950584923002495-main.pdf,Test Code Flakiness in Mobile Apps: The Developer’s Perspective,https://doi.org/10.1016/j.infsof.2023.107394
https://www.sciencedirect.com/science/article/pii/S229196942300025X,,Machine Learning–Enabled Clinical Information Systems Using Fast Healthcare Interoperability Resources Data Standards: Scoping Review,https://doi.org/10.2196/48297
https://www.sciencedirect.com/science/article/pii/S2949719124000621,https://www.sciencedirect.com/science/article/pii/S2949719124000621/pdfft?md5=c4eb67477c4d7dcee77747ddc4474843&pid=1-s2.0-S2949719124000621-main.pdf,Validating pretrained language models for content quality classification with semantic-preserving metamorphic relations,https://doi.org/10.1016/j.nlp.2024.100114
https://www.sciencedirect.com/science/article/pii/S0167404824004899,,Towards prompt tuning-based software vulnerability assessment with continual learning,https://doi.org/10.1016/j.cose.2024.104184
https://www.sciencedirect.com/science/article/pii/S0164121225001372,,FedMVA: Enhancing software vulnerability assessment via federated multimodal learning,https://doi.org/10.1016/j.jss.2025.112469
https://www.sciencedirect.com/science/article/pii/S0950584924000545,,Technical risk model of machine learning based software project development - A multinational empirical study using modified Delphi-AHP method,https://doi.org/10.1016/j.infsof.2024.107449
https://www.sciencedirect.com/science/article/pii/S0164121224001973,,Automated program repair for variability bugs in software product line systems,https://doi.org/10.1016/j.jss.2024.112152
https://www.sciencedirect.com/science/article/pii/S1574013724000650,,ISO/IEC quality standards for AI engineering,https://doi.org/10.1016/j.cosrev.2024.100681
https://www.sciencedirect.com/science/article/pii/S0950584923001179,https://www.sciencedirect.com/science/article/pii/S0950584923001179/pdfft?md5=395c0630ed06ab8bac2daa2e9744f531&pid=1-s2.0-S0950584923001179-main.pdf,Metamorphic testing of chess engines,https://doi.org/10.1016/j.infsof.2023.107263
https://www.sciencedirect.com/science/article/pii/S0164121224001912,,End-to-end log statement generation at block-level,https://doi.org/10.1016/j.jss.2024.112146
https://www.sciencedirect.com/science/article/pii/S0957417424029464,,Enhancing deep learning-based side-channel analysis using feature engineering in a fully simulated IoT system,https://doi.org/10.1016/j.eswa.2024.126079
https://www.sciencedirect.com/science/article/pii/S2949761224001019,https://www.sciencedirect.com/science/article/pii/S2949761224001019/pdfft?md5=5a6aab1a2f9cca0df4d9de135b81f6cf&pid=1-s2.0-S2949761224001019-main.pdf,Assessments of Generative Artificial Intelligence as Clinical Decision Support Ought to be Incorporated Into Randomized Controlled Trials of Electronic Alerts for Acute Kidney Injury,https://doi.org/10.1016/j.mcpdig.2024.09.004
https://www.sciencedirect.com/science/article/pii/S2817170524000206,,Generating Synthetic Electronic Health Record Data Using Generative Adversarial Networks: Tutorial,https://doi.org/10.2196/52615
https://www.sciencedirect.com/science/article/pii/S000145752500048X,,Generation of critical pedestrian scenarios for autonomous vehicle testing,https://doi.org/10.1016/j.aap.2025.107962
https://www.sciencedirect.com/science/article/pii/S2352301825000785,,The future of HIV diagnostics: an exemplar in infectious diseases,https://doi.org/10.1016/S2352-3018(25)00078-5
https://www.sciencedirect.com/science/article/pii/S1319157824002076,https://www.sciencedirect.com/science/article/pii/S1319157824002076/pdfft?md5=8ae41f972f5fcb180b95390116c548b9&pid=1-s2.0-S1319157824002076-main.pdf,An empirical study on the state-of-the-art methods for requirement-to-code traceability link recovery,https://doi.org/10.1016/j.jksuci.2024.102118
https://www.sciencedirect.com/science/article/pii/S236879592400088X,,Self-Administered Interventions Based on Natural Language Processing Models for Reducing Depressive and Anxiety Symptoms: Systematic Review and Meta-Analysis,https://doi.org/10.2196/59560
https://www.sciencedirect.com/science/article/pii/S0363811124000869,,Beyond the code: The impact of AI algorithm transparency signaling on user trust and relational satisfaction,https://doi.org/10.1016/j.pubrev.2024.102507
https://www.sciencedirect.com/science/article/pii/S0893608024009961,https://www.sciencedirect.com/science/article/pii/S0893608024009961/pdfft?md5=3c8784ecc2ac1bd24ef27f6cbfc38c95&pid=1-s2.0-S0893608024009961-main.pdf,Promises and perils of using Transformer-based models for SE research,https://doi.org/10.1016/j.neunet.2024.107067
https://www.sciencedirect.com/science/article/pii/S0140366422002377,,Neural language models for network configuration: Opportunities and reality check,https://doi.org/10.1016/j.comcom.2022.06.035
https://www.sciencedirect.com/science/article/pii/B9780443300400099938,https://www.sciencedirect.com/science/article/pii/B9780443300400099938/pdfft?md5=753e356e27f821f4e3c8be79cd89d0ee&pid=3-s2.0-B9780443300400099938-main.pdf,Index,https://doi.org/10.1016/B978-0-443-30040-0.09993-8
https://www.sciencedirect.com/science/article/pii/S0164121224003017,https://www.sciencedirect.com/science/article/pii/S0164121224003017/pdfft?md5=28db5a8ea45de669f7ad7b8be9be8c69&pid=1-s2.0-S0164121224003017-main.pdf,"A model-driven, metrics-based approach to assessing support for quality aspects in MLOps system architectures",https://doi.org/10.1016/j.jss.2024.112257
