link,pdf_link,title,authors,abstract,submitted
https://arxiv.org/abs/2506.15624,https://arxiv.org/pdf/2506.15624,The Effect of State Representation on LLM Agent Behavior in Dynamic Routing Games,"Lyle Goodyear, Rachel Guo, Ramesh Johari","LargeLanguageModels (LLMs) have shown promise as decision-makers in dynamic settings, but their stateless nature necessitates creating a natural language representation of history. We present a unifying framework for systematically constructing natural language ""state"" representations for prompting LLM agents in repeated multi-agent games. Previous work on games with LLM agents has taken an ad hoc approach to encoding game history, which not only obscures the impact of state representation on agents' behavior, but also limits comparability between studies. Our framework addresses these gaps by characterizing methods of state representation along three axes: action informativeness (i.e., the extent to which the state representation captures actions played); reward informativeness (i.e., the extent to which the state representation describes rewards obtained); and prompting style (or natural language compression, i.e., the extent to which the full text history is summarized). We apply this framework to a dynamic selfish routing game, chosen because it admits a simple equilibrium both in theory and in human subject experiments \cite{rapoport_choice_2009}. Despite the game's relative simplicity, we find that there are key dependencies of LLM agent behavior on the natural language state representation. In particular, we observe that representations which provide agents with (1) summarized, rather than complete, natural language representations of past history; (2) information about regrets, rather than raw payoffs; and (3) limited information about others' actions lead to behavior that more closely matches game theoretic equilibrium predictions, and with more stable game play by the agents. By contrast, other representations can exhibit either large deviations from equilibrium, higher variation in dynamic game play over time, or both.","Submitted 18 June, 2025; originally announced June 2025."
https://arxiv.org/abs/2506.15567,https://arxiv.org/pdf/2506.15567,Managing Complex Failure Analysis Workflows with LLM-based Reasoning and Acting Agents,"Aline Dobrovsky, Konstantin Schekotihin, Christian Burmer","Failure Analysis (FA) is a highly intricate and knowledge-intensive process. The integration of AI components within the computational infrastructure of FA labs has the potential to automate a variety of tasks, including the detection of non-conformities in images, the retrieval of analogous cases from diverse data sources, and the generation of reports from annotated images. However, as the number of deployed AI models increases, the challenge lies in orchestrating these components into cohesive and efficient workflows that seamlessly integrate with the FA process. This paper investigates the design and implementation of a LargeLanguageModel (LLM)-based Planning Agent (LPA) to assist FA engineers in solving their analysis cases. The LPA integrates LLMs with advanced planning capabilities and external tool utilization, enabling autonomous processing of complex queries, retrieval of relevant data from external systems, and generation of human-readable responses. Evaluation results demonstrate the agent's operational effectiveness and reliability in supporting FA tasks.","Submitted 18 June, 2025; originally announced June 2025."
https://arxiv.org/abs/2506.15451,https://arxiv.org/pdf/2506.15451,AgentGroupChat-V2: Divide-and-Conquer Is What LLM-Based Multi-Agent System Need,"Zhouhong Gu, Xiaoxuan Zhu, Yin Cai, Hao Shen, Xingzhou Chen, Qingyi Wang, Jialin Li, Xiaoran Shi, Haoran Guo, Wenxuan Huang, Hongwei Feng, Yanghua Xiao, Zheyu Ye, Yao Hu, Shaosheng Cao","Largelanguagemodel based multi-agent systems have demonstrated significant potential in social simulation and complex task resolution domains. However, current frameworks face critical challenges in system architecture design, cross-domain generalizability, and performance guarantees, particularly as task complexity and number of agents increases. We introduces AgentGroupChat-V2, a novel framework addressing these challenges through three core innovations: (1) a divide-and-conquer fully parallel architecture that decomposes user queries into hierarchical task forest structures enabling dependency management and distributed concurrent processing. (2) an adaptive collaboration engine that dynamically selects heterogeneous LLM combinations and interaction modes based on task characteristics. (3) agent organization optimization strategies combining divide-and-conquer approaches for efficient problem decomposition. Extensive experiments demonstrate AgentGroupChat-V2's superior performance across diverse domains, achieving 91.50% accuracy on GSM8K (exceeding the best baseline by 5.6 percentage points), 30.4% accuracy on competition-level AIME (nearly doubling other methods), and 79.20% pass@1 on HumanEval. Performance advantages become increasingly pronounced with higher task difficulty, particularly on Level 5 MATH problems where improvements exceed 11 percentage points compared to state-of-the-art baselines. These results confirm that AgentGroupChat-V2 provides a comprehensive solution for building efficient, general-purpose LLM multi-agent systems with significant advantages in complex reasoning scenarios. Code is available at https://github.com/MikeGu721/AgentGroupChat-V2.","Submitted 18 June, 2025; originally announced June 2025."
https://arxiv.org/abs/2506.15425,https://arxiv.org/pdf/2506.15425,Understanding GUI Agent Localization Biases through Logit Sharpness,"Xingjian Tao, Yiwei Wang, Yujun Cai, Zhicheng Yang, Jing Tang","Multimodal largelanguagemodels (MLLMs) have enabled GUI agents to interact with operating systems by grounding language into spatial actions. Despite their promising performance, these models frequently exhibit hallucinations-systematic localization errors that compromise reliability. We propose a fine-grained evaluation framework that categorizes model predictions into four distinct types, revealing nuanced failure modes beyond traditional accuracy metrics. To better quantify model uncertainty, we introduce the Peak Sharpness Score (PSS), a metric that evaluates the alignment between semantic continuity and logits distribution in coordinate prediction. Building on this insight, we further propose Context-Aware Cropping, a training-free technique that improves model performance by adaptively refining input context. Extensive experiments demonstrate that our framework and methods provide actionable insights and enhance the interpretability and robustness of GUI agent behavior.","Submitted 18 June, 2025; originally announced June 2025."
https://arxiv.org/abs/2506.15253,https://arxiv.org/pdf/2506.15253,RAS-Eval: A Comprehensive Benchmark for Security Evaluation of LLM Agents in Real-World Environments,"Yuchuan Fu, Xiaohan Yuan, Dongxia Wang","The rapid deployment of Largelanguagemodel (LLM) agents in critical domains like healthcare and finance necessitates robust security frameworks. To address the absence of standardized evaluation benchmarks for these agents in dynamic environments, we introduce RAS-Eval, a comprehensive security benchmark supporting both simulated and real-world tool execution. RAS-Eval comprises 80 test cases and 3,802 attack tasks mapped to 11 Common Weakness Enumeration (CWE) categories, with tools implemented in JSON, LangGraph, and Model Context Protocol (MCP) formats. We evaluate 6 state-of-the-art LLMs across diverse scenarios, revealing significant vulnerabilities: attacks reduced agent task completion rates (TCR) by 36.78% on average and achieved an 85.65% success rate in academic settings. Notably, scaling laws held for security capabilities, with larger models outperforming smaller counterparts. Our findings expose critical risks in real-world agent deployments and provide a foundational framework for future security research. Code and data are available at https://github.com/lanzer-tree/RAS-Eval.","Submitted 18 June, 2025; originally announced June 2025."
https://arxiv.org/abs/2506.15170,https://arxiv.org/pdf/2506.15170,From LLMs to MLLMs to Agents: A Survey of Emerging Paradigms in Jailbreak Attacks and Defenses within LLM Ecosystem,"Yanxu Mao, Tiehan Cui, Peipei Liu, Datao You, Hongsong Zhu","Largelanguagemodels (LLMs) are rapidly evolving from single-modal systems to multimodal LLMs and intelligent agents, significantly expanding their capabilities while introducing increasingly severe security risks. This paper presents a systematic survey of the growing complexity of jailbreak attacks and corresponding defense mechanisms within the expanding LLM ecosystem. We first trace the developmental trajectory from LLMs to MLLMs and Agents, highlighting the core security challenges emerging at each stage. Next, we categorize mainstream jailbreak techniques from both the attack impact and visibility perspectives, and provide a comprehensive analysis of representative attack methods, related datasets, and evaluation metrics. On the defense side, we organize existing strategies based on response timing and technical approach, offering a structured understanding of their applicability and implementation. Furthermore, we identify key limitations in existing surveys, such as insufficient attention to agent-specific security issues, the absence of a clear taxonomy for hybrid jailbreak methods, a lack of detailed analysis of experimental setups, and outdated coverage of recent advancements. To address these limitations, we provide an updated synthesis of recent work and outline future research directions in areas such as dataset construction, evaluation framework optimization, and strategy generalization. Our study seeks to enhance the understanding of jailbreak mechanisms and facilitate the advancement of more resilient and adaptive defense strategies in the context of ever more capable LLMs.","Submitted 18 June, 2025; originally announced June 2025."
https://arxiv.org/abs/2506.15167,https://arxiv.org/pdf/2506.15167,LLM Agent for Hyper-Parameter Optimization,"Wanzhe Wang, Jianqiu Peng, Menghao Hu, Weihuang Zhong, Tong Zhang, Shuai Wang, Yixin Zhang, Mingjie Shao, Wanli Ni","Hyper-parameters are essential and critical for the performance of communication algorithms. However, current hyper-parameters tuning methods for warm-start particles swarm optimization with cross and mutation (WS-PSO-CM) algortihm for radio map-enabled unmanned aerial vehicle (UAV) trajectory and communication are primarily heuristic-based, exhibiting low levels of automation and unsatisfactory performance. In this paper, we design an largelanguagemodel (LLM) agent for automatic hyper-parameters-tuning, where an iterative framework and model context protocol (MCP) are applied. In particular, the LLM agent is first setup via a profile, which specifies the mission, background, and output format. Then, the LLM agent is driven by the prompt requirement, and iteratively invokes WS-PSO-CM algorithm for exploration. Finally, the LLM agent autonomously terminates the loop and returns a set of hyper-parameters. Our experiment results show that the minimal sum-rate achieved by hyper-parameters generated via our LLM agent is significantly higher than those by both human heuristics and random generation methods. This indicates that an LLM agent with PSO knowledge and WS-PSO-CM algorithm background is useful in finding high-performance hyper-parameters.","Submitted 18 June, 2025; originally announced June 2025."
https://arxiv.org/abs/2506.15065,https://arxiv.org/pdf/2506.15065,HEAL: An Empirical Study on Hallucinations in Embodied Agents Driven by LargeLanguageModels,"Trishna Chakraborty, Udita Ghosh, Xiaopan Zhang, Fahim Faisal Niloy, Yue Dong, Jiachen Li, Amit K. Roy-Chowdhury, Chengyu Song","Largelanguagemodels (LLMs) are increasingly being adopted as the cognitive core of embodied agents. However, inherited hallucinations, which stem from failures to ground user instructions in the observed physical environment, can lead to navigation errors, such as searching for a refrigerator that does not exist. In this paper, we present the first systematic study of hallucinations in LLM-based embodied agents performing long-horizon tasks under scene-task inconsistencies. Our goal is to understand to what extent hallucinations occur, what types of inconsistencies trigger them, and how current models respond. To achieve these goals, we construct a hallucination probing set by building on an existing benchmark, capable of inducing hallucination rates up to 40x higher than base prompts. Evaluating 12 models across two simulation environments, we find that while models exhibit reasoning, they fail to resolve scene-task inconsistencies-highlighting fundamental limitations in handling infeasible tasks. We also provide actionable insights on ideal model behavior for each scenario, offering guidance for developing more robust and reliable planning strategies.","Submitted 17 June, 2025; originally announced June 2025."
https://arxiv.org/abs/2506.14728,https://arxiv.org/pdf/2506.14728,AgentDistill: Training-Free Agent Distillation with Generalizable MCP Boxes,"Jiahao Qiu, Xinzhe Juan, Yimin Wang, Ling Yang, Xuan Qi, Tongcheng Zhang, Jiacheng Guo, Yifu Lu, Zixin Yao, Hongru Wang, Shilong Liu, Xun Jiang, Liu Leqi, Mengdi Wang","While knowledge distillation has become a mature field for compressing largelanguagemodels (LLMs) into smaller ones by aligning their outputs or internal representations, the distillation of LLM-based agents, which involve planning, memory, and tool use, remains relatively underexplored. Existing agent distillation methods typically replay full teacher trajectories or imitate step-by-step teacher tool usage, but they often struggle to train student agents to dynamically plan and act in novel environments. We propose AgentDistill, a novel, training-free agent distillation framework that enables efficient and scalable knowledge transfer via direct reuse of Model-Context-Protocols (MCPs), which are structured and reusable task-solving modules autonomously generated by teacher agents. The reuse of these distilled MCPs enables student agents to generalize their capabilities across domains and solve new problems with minimal supervision or human intervention. Experiments on biomedical and mathematical benchmarks demonstrate that our distilled student agents, built on small language models, can achieve performance comparable to advanced systems using large LLMs such as OctoTools (GPT-4o), highlighting the effectiveness of our framework in building scalable and cost-efficient intelligent agents.","Submitted 17 June, 2025; originally announced June 2025."
https://arxiv.org/abs/2506.14683,https://arxiv.org/pdf/2506.14683,Unified Software Engineering agent as AI Software Engineer,"Leonhard Applis, Yuntong Zhang, Shanchao Liang, Nan Jiang, Lin Tan, Abhik Roychoudhury","The growth of LargeLanguageModel (LLM) technology has raised expectations for automated coding. However, software engineering is more than coding and is concerned with activities including maintenance and evolution of a project. In this context, the concept of LLM agents has gained traction, which utilize LLMs as reasoning engines to invoke external tools autonomously. But is an LLM agent the same as an AI software engineer? In this paper, we seek to understand this question by developing a Unified Software Engineering agent or USEagent. Unlike existing work which builds specialized agents for specific software tasks such as testing, debugging, and repair, our goal is to build a unified agent which can orchestrate and handle multiple capabilities. This gives the agent the promise of handling complex scenarios in software development such as fixing an incomplete patch, adding new features, or taking over code written by others. We envision USEagent as the first draft of a future AI Software Engineer which can be a team member in future software development teams involving both AI and humans. To evaluate the efficacy of USEagent, we build a Unified Software Engineering bench (USEbench) comprising of myriad tasks such as coding, testing, and patching. USEbench is a judicious mixture of tasks from existing benchmarks such as SWE-bench, SWT-bench, and REPOCOD. In an evaluation on USEbench consisting of 1,271 repository-level software engineering tasks, USEagent shows improved efficacy compared to existing general agents such as OpenHands CodeActAgent. There exist gaps in the capabilities of USEagent for certain coding tasks, which provides hints on further developing the AI Software Engineer of the future.","Submitted 17 June, 2025; originally announced June 2025."
https://arxiv.org/abs/2506.14580,https://arxiv.org/pdf/2506.14580,GenerationPrograms: Fine-grained Attribution with Executable Programs,"David Wan, Eran Hirsch, Elias Stengel-Eskin, Ido Dagan, Mohit Bansal","Recent largelanguagemodels (LLMs) achieve impressive performance in source-conditioned text generation but often fail to correctly provide fine-grained attributions for their outputs, undermining verifiability and trust. Moreover, existing attribution methods do not explain how and why models leverage the provided source documents to generate their final responses, limiting interpretability. To overcome these challenges, we introduce a modular generation framework, GenerationPrograms, inspired by recent advancements in executable ""code agent"" architectures. Unlike conventional generation methods that simultaneously generate outputs and attributions or rely on post-hoc attribution, GenerationPrograms decomposes the process into two distinct stages: first, creating an executable program plan composed of modular text operations (such as paraphrasing, compression, and fusion) explicitly tailored to the query, and second, executing these operations following the program's specified instructions to produce the final response. Empirical evaluations demonstrate that GenerationPrograms significantly improves attribution quality at both the document level and sentence level across two long-form question-answering tasks and a multi-document summarization task. We further demonstrate that GenerationPrograms can effectively function as a post-hoc attribution method, outperforming traditional techniques in recovering accurate attributions. In addition, the interpretable programs generated by GenerationPrograms enable localized refinement through modular-level improvements that further enhance overall attribution quality.","Submitted 17 June, 2025; originally announced June 2025."
https://arxiv.org/abs/2506.14539,https://arxiv.org/pdf/2506.14539,Doppelganger Method: Breaking Role Consistency in LLM Agent via Prompt-based Transferable Adversarial Attack,"Daewon Kang, YeongHwan Shin, Doyeon Kim, Kyu-Hwan Jung, Meong Hi Son","Since the advent of largelanguagemodels, prompt engineering now enables the rapid, low-effort creation of diverse autonomous agents that are already in widespread use. Yet this convenience raises urgent concerns about the safety, robustness, and behavioral consistency of the underlying prompts, along with the pressing challenge of preventing those prompts from being exposed to user's attempts. In this paper, we propose the ''Doppelganger method'' to demonstrate the risk of an agent being hijacked, thereby exposing system instructions and internal information. Next, we define the ''Prompt Alignment Collapse under Adversarial Transfer (PACAT)'' level to evaluate the vulnerability to this adversarial transfer attack. We also propose a ''Caution for Adversarial Transfer (CAT)'' prompt to counter the Doppelganger method. The experimental results demonstrate that the Doppelganger method can compromise the agent's consistency and expose its internal information. In contrast, CAT prompts enable effective defense against this adversarial attack.","Submitted 26 June, 2025; v1 submitted 17 June, 2025; originally announced June 2025."
https://arxiv.org/abs/2506.14529,https://arxiv.org/pdf/2506.14529,Automated Decision-Making on Networks with LLMs through Knowledge-Guided Evolution,"Xiaohan Zheng, Lanning Wei, Yong Li, Quanming Yao","Effective decision-making on networks often relies on learning from graph-structured data, where Graph Neural Networks (GNNs) play a central role, but they take efforts to configure and tune. In this demo, we propose LLMNet, showing how to design GNN automated through LargeLanguageModels. Our system develops a set of agents that construct graph-related knowlege bases and then leverages Retrieval-Augmented Generation (RAG) to support automated configuration and refinement of GNN models through a knowledge-guided evolution process. These agents, equipped with specialized knowledge bases, extract insights into tasks and graph structures by interacting with the knowledge bases. Empirical results show LLMNet excels in twelve datasets across three graph learning tasks, validating its effectiveness of GNN model designing.","Submitted 17 June, 2025; originally announced June 2025."
https://arxiv.org/abs/2506.14512,https://arxiv.org/pdf/2506.14512,SIRI-Bench: Challenging VLMs' Spatial Intelligence through Complex Reasoning Tasks,"Zijian Song, Xiaoxin Lin, Qiuming Huang, Guangrun Wang, Liang Lin","LargeLanguageModels (LLMs) are experiencing rapid advancements in complex reasoning, exhibiting remarkable generalization in mathematics and programming. In contrast, while spatial intelligence is fundamental for Vision-Language Models (VLMs) in real-world interaction, the systematic evaluation of their complex reasoning ability within spatial contexts remains underexplored. To bridge this gap, we introduce SIRI-Bench, a benchmark designed to evaluate VLMs' spatial intelligence through video-based reasoning tasks. SIRI-Bench comprises nearly 1K video-question-answer triplets, where each problem is embedded in a realistic 3D scene and captured by video. By carefully designing questions and corresponding 3D scenes, our benchmark ensures that solving the questions requires both spatial comprehension for extracting information and high-level reasoning for deriving solutions, making it a challenging benchmark for evaluating VLMs. To facilitate large-scale data synthesis, we develop an Automatic Scene Creation Engine. This engine, leveraging multiple specialized LLM agents, can generate realistic 3D scenes from abstract math problems, ensuring faithfulness to the original descriptions. Experimental results reveal that state-of-the-art VLMs struggle significantly on SIRI-Bench, underscoring the challenge of spatial reasoning. We hope that our study will bring researchers' attention to spatially grounded reasoning and advance VLMs in visual problem-solving.","Submitted 17 June, 2025; originally announced June 2025."
https://arxiv.org/abs/2506.14496,https://arxiv.org/pdf/2506.14496,LLM-Powered Swarms: A New Frontier or a Conceptual Stretch?,"Muhammad Atta Ur Rahman, Melanie Schranz","Swarm intelligence traditionally refers to systems of simple, decentralized agents whose local interactions lead to emergent, collective behavior. Recently, the term 'swarm' has been extended to describe AI systems like OpenAI's Swarm, where largelanguagemodels (LLMs) act as collaborative agents. This paper contrasts traditional swarm algorithms with LLM-driven swarms exploring how decentralization, scalability, and emergence are redefined in modern artificial intelligence (AI). We implement and compare both paradigms using Boids and Ant Colony Optimization (ACO), evaluating latency, resource usage, and behavioral accuracy. The suitability of both cloud-based and local LLMs is assessed for the agent-based use in swarms. Although LLMs offer powerful reasoning and abstraction capabilities, they introduce new constraints in computation and coordination that challenge traditional notions of swarm design. This study highlights the opportunities and limitations of integrating LLMs into swarm systems and discusses the evolving definition of 'swarm' in modern AI research.","Submitted 17 June, 2025; originally announced June 2025."
