link,pdf_link,title,authors,abstract,submitted
https://arxiv.org/abs/2506.04255,https://arxiv.org/pdf/2506.04255,HASHIRU: Hierarchical Agent System for Hybrid Intelligent Resource Utilization,"Kunal Pai, Parth Shah, Harshil Patel","Rapid LargeLanguageModel (LLM) advancements are fueling autonomous Multi-Agent System (MAS) development. However, current frameworks often lack flexibility, resource awareness, model diversity, and autonomous tool creation. This paper introduces HASHIRU (Hierarchical Agent System for Hybrid Intelligent Resource Utilization), a novel MAS framework enhancing flexibility, resource efficiency, and adaptability. HASHIRU features a ""CEO"" agent dynamically managing specialized ""employee"" agents, instantiated based on task needs and resource constraints (cost, memory). Its hybrid intelligence prioritizes smaller, local LLMs (via Ollama) while flexibly using external APIs and larger models when necessary. An economic model with hiring/firing costs promotes team stability and efficient resource allocation. The system also includes autonomous API tool creation and a memory function. Evaluations on tasks like academic paper review (58% success), safety assessments (100% on a JailbreakBench subset), and complex reasoning (outperforming Gemini 2.0 Flash on GSM8K: 96% vs. 61%; JEEBench: 80% vs. 68.3%; SVAMP: 92% vs. 84%) demonstrate HASHIRU's capabilities. Case studies illustrate its self-improvement via autonomous cost model generation, tool integration, and budget management. HASHIRU offers a promising approach for more robust, efficient, and adaptable MAS through dynamic hierarchical control, resource-aware hybrid intelligence, and autonomous functional extension. Source code and benchmarks are available at https://github.com/HASHIRU-AI/HASHIRU and https://github.com/HASHIRU-AI/HASHIRUBench respectively, and a live demo is available at https://hashiruagentx-hashiruai.hf.space upon request.","Submitted 1 June, 2025; originally announced June 2025."
https://arxiv.org/abs/2506.04253,https://arxiv.org/pdf/2506.04253,HADA: Human-AI Agent Decision Alignment Architecture,"Tapio Pitkäranta, Leena Pitkäranta","We present HADA (Human-AI Agent Decision Alignment), a protocol- and framework agnostic reference architecture that keeps both largelanguagemodel (LLM) agents and legacy algorithms aligned with organizational targets and values. HADA wraps any algorithm or LLM in role-specific stakeholder agents -- business, data-science, audit, ethics, and customer -- each exposing conversational APIs so that technical and non-technical actors can query, steer, audit, or contest every decision across strategic, tactical, and real-time horizons. Alignment objectives, KPIs, and value constraints are expressed in natural language and are continuously propagated, logged, and versioned while thousands of heterogeneous agents run on different orchestration stacks. A cloud-native proof of concept packages a production credit-scoring model (getLoanDecision) and deploys it on Docker/Kubernetes/Python; five scripted retail-bank scenarios show how target changes, parameter tweaks, explanation requests, and ethics triggers flow end to end through the architecture. Evaluation followed the Design-Science Research Methodology. Walkthrough observation and log inspection demonstrated complete coverage of six predefined objectives: every role could invoke conversational control, trace KPIs and value constraints, detect and mitigate ZIP-code bias, and reproduce full decision lineage, independent of the underlying LLM or agent library. Contributions: (1) an open-source HADA architecture, (2) a mid-range design theory for human-AI alignment in multi-agent systems, and (3) empirical evidence that framework-agnostic, protocol-compliant stakeholder agents improve accuracy, transparency, and ethical compliance in real-world decision pipelines.","Submitted 1 June, 2025; originally announced June 2025."
https://arxiv.org/abs/2506.04251,https://arxiv.org/pdf/2506.04251,Language-Guided Multi-Agent Learning in Simulations: A Unified Framework and Evaluation,Zhengyang Li,"This paper introduces LLM-MARL, a unified framework that incorporates largelanguagemodels (LLMs) into multi-agent reinforcement learning (MARL) to enhance coordination, communication, and generalization in simulated game environments. The framework features three modular components of Coordinator, Communicator, and Memory, which dynamically generate subgoals, facilitate symbolic inter-agent messaging, and support episodic recall. Training combines PPO with a language-conditioned loss and LLM query gating. LLM-MARL is evaluated in Google Research Football, MAgent Battle, and StarCraft II. Results show consistent improvements over MAPPO and QMIX in win rate, coordination score, and zero-shot generalization. Ablation studies demonstrate that subgoal generation and language-based messaging each contribute significantly to performance gains. Qualitative analysis reveals emergent behaviors such as role specialization and communication-driven tactics. By bridging language modeling and policy learning, this work contributes to the design of intelligent, cooperative agents in interactive simulations. It offers a path forward for leveraging LLMs in multi-agent systems used for training, games, and human-AI collaboration.","Submitted 1 June, 2025; originally announced June 2025."
https://arxiv.org/abs/2506.04236,https://arxiv.org/pdf/2506.04236,"Spore in the Wild: Case Study on Spore.fun, a Real-World Experiment of Sovereign Agent Open-ended Evolution on Blockchain with TEEs","Botao Amber Hu, Helena Rong","In Artificial Life (ALife) research, replicating Open-Ended Evolution (OEE)-the continuous emergence of novelty observed in biological life-has traditionally been pursued within isolated closed system simulations, such as Tierra and Avida, which have typically plateaued after an initial burst of novelty, failing to achieve sustained OEE. Scholars suggest that OEE requires an ""open"" system that continually exchanges information or energy with its environment. A recent technological innovation in decentralized physical infrastructure networks (DePIN) providing permissionless computational substrates enables deploying largelanguagemodel (LLM)-based AI agents on blockchains integrated with Trusted Execution Environments (TEEs). This enables on-chain agents to operate autonomously ""in the wild,"" achieving self-sovereignty without human oversight. These agents can control their own social media accounts and cryptocurrency wallets, allowing them to interact directly with blockchain-based financial networks and broader human social media. Building on this new paradigm of on-chain agents, Spore.fun is a recent real-world AI evolution experiment that enables autonomous breeding and evolution of new on-chain agents. This paper presents a detailed case study of Spore.fun, examining agent behaviors and their evolutionary trajectories through digital ethology. We aim to spark discussion about whether ""open"" ALife systems ""in-the-wild,"" based on permissionless computational substrates and driven by economic incentives to interact with their environment, could finally achieve the long-sought goal of OEE.","Submitted 24 May, 2025; originally announced June 2025."
https://arxiv.org/abs/2506.04202,https://arxiv.org/pdf/2506.04202,TracLLM: A Generic Framework for Attributing Long Context LLMs,"Yanting Wang, Wei Zou, Runpeng Geng, Jinyuan Jia","Long context largelanguagemodels (LLMs) are deployed in many real-world applications such as RAG, agent, and broad LLM-integrated applications. Given an instruction and a long context (e.g., documents, PDF files, webpages), a long context LLM can generate an output grounded in the provided context, aiming to provide more accurate, up-to-date, and verifiable outputs while reducing hallucinations and unsupported claims. This raises a research question: how to pinpoint the texts (e.g., sentences, passages, or paragraphs) in the context that contribute most to or are responsible for the generated output by an LLM? This process, which we call context traceback, has various real-world applications, such as 1) debugging LLM-based systems, 2) conducting post-attack forensic analysis for attacks (e.g., prompt injection attack, knowledge corruption attacks) to an LLM, and 3) highlighting knowledge sources to enhance the trust of users towards outputs generated by LLMs. When applied to context traceback for long context LLMs, existing feature attribution methods such as Shapley have sub-optimal performance and/or incur a large computational cost. In this work, we develop TracLLM, the first generic context traceback framework tailored to long context LLMs. Our framework can improve the effectiveness and efficiency of existing feature attribution methods. To improve the efficiency, we develop an informed search based algorithm in TracLLM. We also develop contribution score ensemble/denoising techniques to improve the accuracy of TracLLM. Our evaluation results show TracLLM can effectively identify texts in a long context that lead to the output of an LLM. Our code and data are at: https://github.com/Wang-Yanting/TracLLM.","Submitted 26 June, 2025; v1 submitted 4 June, 2025; originally announced June 2025."
https://arxiv.org/abs/2506.04180,https://arxiv.org/pdf/2506.04180,SuperWriter: Reflection-Driven Long-Form Generation with LargeLanguageModels,"Yuhao Wu, Yushi Bai, Zhiqiang Hu, Juanzi Li, Roy Ka-Wei Lee","Long-form text generation remains a significant challenge for largelanguagemodels (LLMs), particularly in maintaining coherence, ensuring logical consistency, and preserving text quality as sequence length increases. To address these limitations, we propose SuperWriter-Agent, an agent-based framework designed to enhance the quality and consistency of long-form text generation. SuperWriter-Agent introduces explicit structured thinking-through planning and refinement stages into the generation pipeline, guiding the model to follow a more deliberate and cognitively grounded process akin to that of a professional writer. Based on this framework, we construct a supervised fine-tuning dataset to train a 7B SuperWriter-LM. We further develop a hierarchical Direct Preference Optimization (DPO) procedure that uses Monte Carlo Tree Search (MCTS) to propagate final quality assessments and optimize each generation step accordingly. Empirical results across diverse benchmarks demonstrate that SuperWriter-LM achieves state-of-the-art performance, surpassing even larger-scale baseline models in both automatic evaluation and human evaluation. Furthermore, comprehensive ablation studies demonstrate the effectiveness of hierarchical DPO and underscore the value of incorporating structured thinking steps to improve the quality of long-form text generation.","Submitted 4 June, 2025; originally announced June 2025."
https://arxiv.org/abs/2506.04133,https://arxiv.org/pdf/2506.04133,"TRiSM for Agentic AI: A Review of Trust, Risk, and Security Management in LLM-based Agentic Multi-Agent Systems","Shaina Raza, Ranjan Sapkota, Manoj Karkee, Christos Emmanouilidis","Agentic AI systems, built on largelanguagemodels (LLMs) and deployed in multi-agent configurations, are redefining intelligent autonomy, collaboration and decision-making across enterprise and societal domains. This review presents a structured analysis of Trust, Risk, and Security Management (TRiSM) in the context of LLM-based agentic multi-agent systems (AMAS). We begin by examining the conceptual foundations of agentic AI, its architectural differences from traditional AI agents, and the emerging system designs that enable scalable, tool-using autonomy. The TRiSM in the agentic AI framework is then detailed through four pillars governance, explainability, ModelOps, and privacy/security each contextualized for agentic LLMs. We identify unique threat vectors and introduce a comprehensive risk taxonomy for the agentic AI applications, supported by case studies illustrating real-world vulnerabilities. Furthermore, the paper also surveys trust-building mechanisms, transparency and oversight techniques, and state-of-the-art explainability strategies in distributed LLM agent systems. Additionally, metrics for evaluating trust, interpretability, and human-centered performance are reviewed alongside open benchmarking challenges. Security and privacy are addressed through encryption, adversarial defense, and compliance with evolving AI regulations. The paper concludes with a roadmap for responsible agentic AI, proposing research directions to align emerging multi-agent systems with robust TRiSM principles for safe, accountable, and transparent deployment.","Submitted 4 June, 2025; originally announced June 2025."
https://arxiv.org/abs/2506.04098,https://arxiv.org/pdf/2506.04098,TextAtari: 100K Frames Game Playing with Language Agents,"Wenhao Li, Wenwu Li, Chuyun Shen, Junjie Sheng, Zixiao Huang, Di Wu, Yun Hua, Wei Yin, Xiangfeng Wang, Hongyuan Zha, Bo Jin","We present TextAtari, a benchmark for evaluating language agents on very long-horizon decision-making tasks spanning up to 100,000 steps. By translating the visual state representations of classic Atari games into rich textual descriptions, TextAtari creates a challenging test bed that bridges sequential decision-making with natural language processing. The benchmark includes nearly 100 distinct tasks with varying complexity, action spaces, and planning horizons, all rendered as text through an unsupervised representation learning framework (AtariARI). We evaluate three open-source largelanguagemodels (Qwen2.5-7B, Gemma-7B, and Llama3.1-8B) across three agent frameworks (zero-shot, few-shot chain-of-thought, and reflection reasoning) to assess how different forms of prior knowledge affect performance on these long-horizon challenges. Four scenarios-Basic, Obscured, Manual Augmentation, and Reference-based-investigate the impact of semantic understanding, instruction comprehension, and expert demonstrations on agent decision-making. Our results reveal significant performance gaps between language agents and human players in extensive planning tasks, highlighting challenges in sequential reasoning, state tracking, and strategic planning across tens of thousands of steps. TextAtari provides standardized evaluation protocols, baseline implementations, and a framework for advancing research at the intersection of language models and planning. Our code is available at https://github.com/Lww007/Text-Atari-Agents.","Submitted 10 June, 2025; v1 submitted 4 June, 2025; originally announced June 2025."
https://arxiv.org/abs/2506.04089,https://arxiv.org/pdf/2506.04089,AmbiK: Dataset of Ambiguous Tasks in Kitchen Environment,"Anastasiia Ivanova, Eva Bakaeva, Zoya Volovikova, Alexey K. Kovalev, Aleksandr I. Panov","As a part of an embodied agent, LargeLanguageModels (LLMs) are typically used for behavior planning given natural language instructions from the user. However, dealing with ambiguous instructions in real-world environments remains a challenge for LLMs. Various methods for task ambiguity detection have been proposed. However, it is difficult to compare them because they are tested on different datasets and there is no universal benchmark. For this reason, we propose AmbiK (Ambiguous Tasks in Kitchen Environment), the fully textual dataset of ambiguous instructions addressed to a robot in a kitchen environment. AmbiK was collected with the assistance of LLMs and is human-validated. It comprises 1000 pairs of ambiguous tasks and their unambiguous counterparts, categorized by ambiguity type (Human Preferences, Common Sense Knowledge, Safety), with environment descriptions, clarifying questions and answers, user intents, and task plans, for a total of 2000 tasks. We hope that AmbiK will enable researchers to perform a unified comparison of ambiguity detection methods. AmbiK is available at https://github.com/cog-model/AmbiK-dataset.","Submitted 4 June, 2025; originally announced June 2025."
https://arxiv.org/abs/2506.04018,https://arxiv.org/pdf/2506.04018,AgentMisalignment: Measuring the Propensity for Misaligned Behaviour in LLM-Based Agents,"Akshat Naik, Patrick Quinn, Guillermo Bosch, Emma Gouné, Francisco Javier Campos Zabala, Jason Ross Brown, Edward James Young","As LargeLanguageModel (LLM) agents become more widespread, associated misalignment risks increase. Prior work has examined agents' ability to enact misaligned behaviour (misalignment capability) and their compliance with harmful instructions (misuse propensity). However, the likelihood of agents attempting misaligned behaviours in real-world settings (misalignment propensity) remains poorly understood. We introduce a misalignment propensity benchmark, AgentMisalignment, consisting of a suite of realistic scenarios in which LLM agents have the opportunity to display misaligned behaviour. We organise our evaluations into subcategories of misaligned behaviours, including goal-guarding, resisting shutdown, sandbagging, and power-seeking. We report the performance of frontier models on our benchmark, observing higher misalignment on average when evaluating more capable models. Finally, we systematically vary agent personalities through different system prompts. We find that persona characteristics can dramatically and unpredictably influence misalignment tendencies -- occasionally far more than the choice of model itself -- highlighting the importance of careful system prompt engineering for deployed AI agents. Our work highlights the failure of current alignment methods to generalise to LLM agents, and underscores the need for further propensity evaluations as autonomous systems become more prevalent.","Submitted 4 June, 2025; originally announced June 2025."
https://arxiv.org/abs/2506.03939,https://arxiv.org/pdf/2506.03939,Graph Counselor: Adaptive Graph Exploration via Multi-Agent Synergy to Enhance LLM Reasoning,"Junqi Gao, Xiang Zou, YIng Ai, Dong Li, Yichen Niu, Biqing Qi, Jianxing Liu","Graph Retrieval Augmented Generation (GraphRAG) effectively enhances external knowledge integration capabilities by explicitly modeling knowledge relationships, thereby improving the factual accuracy and generation quality of LargeLanguageModels (LLMs) in specialized domains. However, existing methods suffer from two inherent limitations: 1) Inefficient Information Aggregation: They rely on a single agent and fixed iterative patterns, making it difficult to adaptively capture multi-level textual, structural, and degree information within graph data. 2) Rigid Reasoning Mechanism: They employ preset reasoning schemes, which cannot dynamically adjust reasoning depth nor achieve precise semantic correction. To overcome these limitations, we propose Graph Counselor, an GraphRAG method based on multi-agent collaboration. This method uses the Adaptive Graph Information Extraction Module (AGIEM), where Planning, Thought, and Execution Agents work together to precisely model complex graph structures and dynamically adjust information extraction strategies, addressing the challenges of multi-level dependency modeling and adaptive reasoning depth. Additionally, the Self-Reflection with Multiple Perspectives (SR) module improves the accuracy and semantic consistency of reasoning results through self-reflection and backward reasoning mechanisms. Experiments demonstrate that Graph Counselor outperforms existing methods in multiple graph reasoning tasks, exhibiting higher reasoning accuracy and generalization ability. Our code is available at https://github.com/gjq100/Graph-Counselor.git.","Submitted 4 June, 2025; originally announced June 2025."
https://arxiv.org/abs/2506.03922,https://arxiv.org/pdf/2506.03922,HSSBench: Benchmarking Humanities and Social Sciences Ability for Multimodal LargeLanguageModels,"Zhaolu Kang, Junhao Gong, Jiaxu Yan, Wanke Xia, Yian Wang, Ziwen Wang, Huaxuan Ding, Zhuo Cheng, Wenhao Cao, Zhiyuan Feng, Siqi He, Shannan Yan, Junzhe Chen, Xiaomin He, Chaoya Jiang, Wei Ye, Kaidong Yu, Xuelong Li","Multimodal LargeLanguageModels (MLLMs) have demonstrated significant potential to advance a broad range of domains. However, current benchmarks for evaluating MLLMs primarily emphasize general knowledge and vertical step-by-step reasoning typical of STEM disciplines, while overlooking the distinct needs and potential of the Humanities and Social Sciences (HSS). Tasks in the HSS domain require more horizontal, interdisciplinary thinking and a deep integration of knowledge across related fields, which presents unique challenges for MLLMs, particularly in linking abstract concepts with corresponding visual representations. Addressing this gap, we present HSSBench, a dedicated benchmark designed to assess the capabilities of MLLMs on HSS tasks in multiple languages, including the six official languages of the United Nations. We also introduce a novel data generation pipeline tailored for HSS scenarios, in which multiple domain experts and automated agents collaborate to generate and iteratively refine each sample. HSSBench contains over 13,000 meticulously designed samples, covering six key categories. We benchmark more than 20 mainstream MLLMs on HSSBench and demonstrate that it poses significant challenges even for state-of-the-art models. We hope that this benchmark will inspire further research into enhancing the cross-disciplinary reasoning abilities of MLLMs, especially their capacity to internalize and connect knowledge across fields.","Submitted 4 June, 2025; originally announced June 2025."
https://arxiv.org/abs/2506.03861,https://arxiv.org/pdf/2506.03861,PulseReddit: A Novel Reddit Dataset for Benchmarking MAS in High-Frequency Cryptocurrency Trading,"Qiuhan Han, Qian Wang, Atsushi Yoshikawa, Masayuki Yamamura","High-Frequency Trading (HFT) is pivotal in cryptocurrency markets, demanding rapid decision-making. Social media platforms like Reddit offer valuable, yet underexplored, information for such high-frequency, short-term trading. This paper introduces \textbf{PulseReddit}, a novel dataset that is the first to align large-scale Reddit discussion data with high-frequency cryptocurrency market statistics for short-term trading analysis. We conduct an extensive empirical study using LargeLanguageModel (LLM)-based Multi-Agent Systems (MAS) to investigate the impact of social sentiment from PulseReddit on trading performance. Our experiments conclude that MAS augmented with PulseReddit data achieve superior trading outcomes compared to traditional baselines, particularly in bull markets, and demonstrate robust adaptability across different market regimes. Furthermore, our research provides conclusive insights into the performance-efficiency trade-offs of different LLMs, detailing significant considerations for practical model selection in HFT applications. PulseReddit and our findings establish a foundation for advanced MAS research in HFT, demonstrating the tangible benefits of integrating social media.","Submitted 4 June, 2025; originally announced June 2025."
https://arxiv.org/abs/2506.03828,https://arxiv.org/pdf/2506.03828,AssetOpsBench: Benchmarking AI Agents for Task Automation in Industrial Asset Operations and Maintenance,"Dhaval Patel, Shuxin Lin, James Rayfield, Nianjun Zhou, Roman Vaculin, Natalia Martinez, Fearghal O'donncha, Jayant Kalagnanam","AI for Industrial Asset Lifecycle Management aims to automate complex operational workflows -- such as condition monitoring, maintenance planning, and intervention scheduling -- to reduce human workload and minimize system downtime. Traditional AI/ML approaches have primarily tackled these problems in isolation, solving narrow tasks within the broader operational pipeline. In contrast, the emergence of AI agents and largelanguagemodels (LLMs) introduces a next-generation opportunity: enabling end-to-end automation across the entire asset lifecycle. This paper envisions a future where AI agents autonomously manage tasks that previously required distinct expertise and manual coordination. To this end, we introduce AssetOpsBench -- a unified framework and environment designed to guide the development, orchestration, and evaluation of domain-specific agents tailored for Industry 4.0 applications. We outline the key requirements for such holistic systems and provide actionable insights into building agents that integrate perception, reasoning, and control for real-world industrial operations. The software is available at https://github.com/IBM/AssetOpsBench.","Submitted 4 June, 2025; originally announced June 2025."
