link,pdf_link,title,authors,abstract,submitted
https://arxiv.org/abs/2506.09655,https://arxiv.org/pdf/2506.09655,DipLLM: Fine-Tuning LLM for Strategic Decision-making in Diplomacy,"Kaixuan Xu, Jiajun Chai, Sicheng Li, Yuqian Fu, Yuanheng Zhu, Dongbin Zhao","Diplomacy is a complex multiplayer game that requires both cooperation and competition, posing significant challenges for AI systems. Traditional methods rely on equilibrium search to generate extensive game data for training, which demands substantial computational resources. LargeLanguageModels (LLMs) offer a promising alternative, leveraging pre-trained knowledge to achieve strong performance with relatively small-scale fine-tuning. However, applying LLMs to Diplomacy remains challenging due to the exponential growth of possible action combinations and the intricate strategic interactions among players. To address this challenge, we propose DipLLM, a fine-tuned LLM-based agent that learns equilibrium policies for Diplomacy. DipLLM employs an autoregressive factorization framework to simplify the complex task of multi-unit action assignment into a sequence of unit-level decisions. By defining an equilibrium policy within this framework as the learning objective, we fine-tune the model using only 1.5% of the data required by the state-of-the-art Cicero model, surpassing its performance. Our results demonstrate the potential of fine-tuned LLMs for tackling complex strategic decision-making in multiplayer games.","Submitted 23 June, 2025; v1 submitted 11 June, 2025; originally announced June 2025."
https://arxiv.org/abs/2506.09513,https://arxiv.org/pdf/2506.09513,ReasonMed: A 370K Multi-Agent Generated Dataset for Advancing Medical Reasoning,"Yu Sun, Xingyu Qian, Weiwen Xu, Hao Zhang, Chenghao Xiao, Long Li, Yu Rong, Wenbing Huang, Qifeng Bai, Tingyang Xu","Though reasoning-based largelanguagemodels (LLMs) have excelled in mathematics and programming, their capabilities in knowledge-intensive medical question answering remain underexplored. To address this, we introduce ReasonMed, the largest medical reasoning dataset, comprising 370k high-quality examples distilled from 1.7 million initial reasoning paths generated by various LLMs. ReasonMed is constructed through a \textit{multi-agent verification and refinement process}, where we design an \textit{Error Refiner} to enhance the reasoning paths by identifying and correcting error-prone steps flagged by a verifier. Leveraging ReasonMed, we systematically investigate best practices for training medical reasoning models and find that combining detailed Chain-of-Thought (CoT) reasoning with concise answer summaries yields the most effective fine-tuning strategy. Based on this strategy, we train ReasonMed-7B, which sets a new benchmark for sub-10B models, outperforming the prior best by 4.17\% and even exceeding LLaMA3.1-70B on PubMedQA by 4.60\%.","Submitted 11 June, 2025; originally announced June 2025."
https://arxiv.org/abs/2506.09420,https://arxiv.org/pdf/2506.09420,A Call for Collaborative Intelligence: Why Human-Agent Systems Should Precede AI Autonomy,"Henry Peng Zou, Wei-Chieh Huang, Yaozu Wu, Chunyu Miao, Dongyuan Li, Aiwei Liu, Yue Zhou, Yankai Chen, Weizhi Zhang, Yangning Li, Liancheng Fang, Renhe Jiang, Philip S. Yu","Recent improvements in largelanguagemodels (LLMs) have led many researchers to focus on building fully autonomous AI agents. This position paper questions whether this approach is the right path forward, as these autonomous systems still have problems with reliability, transparency, and understanding the actual requirements of human. We suggest a different approach: LLM-based Human-Agent Systems (LLM-HAS), where AI works with humans rather than replacing them. By keeping human involved to provide guidance, answer questions, and maintain control, these systems can be more trustworthy and adaptable. Looking at examples from healthcare, finance, and software development, we show how human-AI teamwork can handle complex tasks better than AI working alone. We also discuss the challenges of building these collaborative systems and offer practical solutions. This paper argues that progress in AI should not be measured by how independent systems become, but by how well they can work with humans. The most promising future for AI is not in systems that take over human roles, but in those that enhance human capabilities through meaningful partnership.","Submitted 11 June, 2025; originally announced June 2025."
https://arxiv.org/abs/2506.09331,https://arxiv.org/pdf/2506.09331,"Multi-Agent Language Models: Advancing Cooperation, Coordination, and Adaptation",Arjun Vaithilingam Sudhakar,"Modern LargeLanguageModels (LLMs) exhibit impressive zero-shot and few-shot generalization capabilities across complex natural language tasks, enabling their widespread use as virtual assistants for diverse applications such as translation and summarization. Despite being trained solely on large corpora of text without explicit supervision on author intent, LLMs appear to infer the underlying meaning of textual interactions. This raises a fundamental question: can LLMs model and reason about the intentions of others, i.e., do they possess a form of theory of mind? Understanding other's intentions is crucial for effective collaboration, which underpins human societal success and is essential for cooperative interactions among multiple agents, including humans and autonomous systems. In this work, we investigate the theory of mind in LLMs through the lens of cooperative multi-agent reinforcement learning (MARL), where agents learn to collaborate via repeated interactions, mirroring human social reasoning. Our approach aims to enhance artificial agent's ability to adapt and cooperate with both artificial and human partners. By leveraging LLM-based agents capable of natural language interaction, we move towards creating hybrid human-AI systems that can foster seamless collaboration, with broad implications for the future of human-artificial interaction.","Submitted 17 June, 2025; v1 submitted 10 June, 2025; originally announced June 2025."
https://arxiv.org/abs/2506.09289,https://arxiv.org/pdf/2506.09289,UTBoost: Rigorous Evaluation of Coding Agents on SWE-Bench,"Boxi Yu, Yuxuan Zhu, Pinjia He, Daniel Kang","The advent of LargeLanguageModels (LLMs) has spurred the development of coding agents for real-world code generation. As a widely used benchmark for evaluating the code generation capabilities of these agents, SWE-Bench uses real-world problems based on GitHub issues and their corresponding pull requests. However, the manually written test cases included in these pull requests are often insufficient, allowing generated patches to pass the tests without resolving the underlying issue. To address this challenge, we introduce UTGenerator, an LLM-driven test case generator that automatically analyzes codebases and dependencies to generate test cases for real-world Python projects. Building on UTGenerator, we propose UTBoost, a comprehensive framework for test case augmentation. In our evaluation, we identified 36 task instances with insufficient test cases and uncovered 345 erroneous patches incorrectly labeled as passed in the original SWE Bench. These corrections, impacting 40.9% of SWE-Bench Lite and 24.4% of SWE-Bench Verified leaderboard entries, yield 18 and 11 ranking changes, respectively.","Submitted 10 June, 2025; originally announced June 2025."
https://arxiv.org/abs/2506.09247,https://arxiv.org/pdf/2506.09247,Agent-based Condition Monitoring Assistance with Multimodal Industrial Database Retrieval Augmented Generation,"Karl Löwenmark, Daniel Strömbergsson, Chang Liu, Marcus Liwicki, Fredrik Sandin","Condition monitoring (CM) plays a crucial role in ensuring reliability and efficiency in the process industry. Although computerised maintenance systems effectively detect and classify faults, tasks like fault severity estimation, and maintenance decisions still largely depend on human expert analysis. The analysis and decision making automatically performed by current systems typically exhibit considerable uncertainty and high false alarm rates, leading to increased workload and reduced efficiency. This work integrates largelanguagemodel (LLM)-based reasoning agents with CM workflows to address analyst and industry needs, namely reducing false alarms, enhancing fault severity estimation, improving decision support, and offering explainable interfaces. We propose MindRAG, a modular framework combining multimodal retrieval-augmented generation (RAG) with novel vector store structures designed specifically for CM data. The framework leverages existing annotations and maintenance work orders as surrogates for labels in a supervised learning protocol, addressing the common challenge of training predictive models on unlabelled and noisy real-world datasets. The primary contributions include: (1) an approach for structuring industry CM data into a semi-structured multimodal vector store compatible with LLM-driven workflows; (2) developing multimodal RAG techniques tailored for CM data; (3) developing practical reasoning agents capable of addressing real-world CM queries; and (4) presenting an experimental framework for integrating and evaluating such agents in realistic industrial scenarios. Preliminary results, evaluated with the help of an experienced analyst, indicate that MindRAG provide meaningful decision support for more efficient management of alarms, thereby improving the interpretability of CM systems.","Submitted 10 June, 2025; originally announced June 2025."
https://arxiv.org/abs/2506.09171,https://arxiv.org/pdf/2506.09171,Improving LLM Agent Planning with In-Context Learning via Atomic Fact Augmentation and Lookahead Search,"Samuel Holt, Max Ruiz Luyten, Thomas Pouplin, Mihaela van der Schaar","LargeLanguageModels (LLMs) are increasingly capable but often require significant guidance or extensive interaction history to perform effectively in complex, interactive environments. Existing methods may struggle with adapting to new information or efficiently utilizing past experiences for multi-step reasoning without fine-tuning. We introduce a novel LLM agent framework that enhances planning capabilities through in-context learning, facilitated by atomic fact augmentation and a recursive lookahead search. Our agent learns to extract task-critical ``atomic facts'' from its interaction trajectories. These facts dynamically augment the prompts provided to LLM-based components responsible for action proposal, latent world model simulation, and state-value estimation. Planning is performed via a depth-limited lookahead search, where the LLM simulates potential trajectories and evaluates their outcomes, guided by the accumulated facts and interaction history. This approach allows the agent to improve its understanding and decision-making online, leveraging its experience to refine its behavior without weight updates. We provide a theoretical motivation linking performance to the quality of fact-based abstraction and LLM simulation accuracy. Empirically, our agent demonstrates improved performance and adaptability on challenging interactive tasks, achieving more optimal behavior as it accumulates experience, showcased in tasks such as TextFrozenLake and ALFWorld.","Submitted 10 June, 2025; originally announced June 2025."
https://arxiv.org/abs/2506.09080,https://arxiv.org/pdf/2506.09080,FinHEAR: Human Expertise and Adaptive Risk-Aware Temporal Reasoning for Financial Decision-Making,"Jiaxiang Chen, Mingxi Zou, Zhuo Wang, Qifan Wang, Dongning Sun, Chi Zhang, Zenglin Xu","Financial decision-making presents unique challenges for language models, demanding temporal reasoning, adaptive risk assessment, and responsiveness to dynamic events. While largelanguagemodels (LLMs) show strong general reasoning capabilities, they often fail to capture behavioral patterns central to human financial decisions-such as expert reliance under information asymmetry, loss-averse sensitivity, and feedback-driven temporal adjustment. We propose FinHEAR, a multi-agent framework for Human Expertise and Adaptive Risk-aware reasoning. FinHEAR orchestrates specialized LLM-based agents to analyze historical trends, interpret current events, and retrieve expert-informed precedents within an event-centric pipeline. Grounded in behavioral economics, it incorporates expert-guided retrieval, confidence-adjusted position sizing, and outcome-based refinement to enhance interpretability and robustness. Empirical results on curated financial datasets show that FinHEAR consistently outperforms strong baselines across trend prediction and trading tasks, achieving higher accuracy and better risk-adjusted returns.","Submitted 10 June, 2025; originally announced June 2025."
https://arxiv.org/abs/2506.09049,https://arxiv.org/pdf/2506.09049,VIKI-R: Coordinating Embodied Multi-Agent Cooperation via Reinforcement Learning,"Li Kang, Xiufeng Song, Heng Zhou, Yiran Qin, Jie Yang, Xiaohong Liu, Philip Torr, Lei Bai, Zhenfei Yin","Coordinating multiple embodied agents in dynamic environments remains a core challenge in artificial intelligence, requiring both perception-driven reasoning and scalable cooperation strategies. While recent works have leveraged largelanguagemodels (LLMs) for multi-agent planning, a few have begun to explore vision-language models (VLMs) for visual reasoning. However, these VLM-based approaches remain limited in their support for diverse embodiment types. In this work, we introduce VIKI-Bench, the first hierarchical benchmark tailored for embodied multi-agent cooperation, featuring three structured levels: agent activation, task planning, and trajectory perception. VIKI-Bench includes diverse robot embodiments, multi-view visual observations, and structured supervision signals to evaluate reasoning grounded in visual inputs. To demonstrate the utility of VIKI-Bench, we propose VIKI-R, a two-stage framework that fine-tunes a pretrained vision-language model (VLM) using Chain-of-Thought annotated demonstrations, followed by reinforcement learning under multi-level reward signals. Our extensive experiments show that VIKI-R significantly outperforms baselines method across all task levels. Furthermore, we show that reinforcement learning enables the emergence of compositional cooperation patterns among heterogeneous agents. Together, VIKI-Bench and VIKI-R offer a unified testbed and method for advancing multi-agent, visual-driven cooperation in embodied AI systems.","Submitted 10 June, 2025; originally announced June 2025."
https://arxiv.org/abs/2506.09046,https://arxiv.org/pdf/2506.09046,Agentic Neural Networks: Self-Evolving Multi-Agent Systems via Textual Backpropagation,"Xiaowen Ma, Chenyang Lin, Yao Zhang, Volker Tresp, Yunpu Ma","Leveraging multiple LargeLanguageModels(LLMs) has proven effective for addressing complex, high-dimensional tasks, but current approaches often rely on static, manually engineered multi-agent configurations. To overcome these constraints, we present the Agentic Neural Network(ANN), a framework that conceptualizes multi-agent collaboration as a layered neural network architecture. In this design, each agent operates as a node, and each layer forms a cooperative ""team"" focused on a specific subtask. Agentic Neural Network follows a two-phase optimization strategy: (1) Forward Phase-Drawing inspiration from neural network forward passes, tasks are dynamically decomposed into subtasks, and cooperative agent teams with suitable aggregation methods are constructed layer by layer. (2) Backward Phase-Mirroring backpropagation, we refine both global and local collaboration through iterative feedback, allowing agents to self-evolve their roles, prompts, and coordination. This neuro-symbolic approach enables ANN to create new or specialized agent teams post-training, delivering notable gains in accuracy and adaptability. Across four benchmark datasets, ANN surpasses leading multi-agent baselines under the same configurations, showing consistent performance improvements. Our findings indicate that ANN provides a scalable, data-driven framework for multi-agent systems, combining the collaborative capabilities of LLMs with the efficiency and flexibility of neural network principles. We plan to open-source the entire framework.","Submitted 10 June, 2025; originally announced June 2025."
https://arxiv.org/abs/2506.08972,https://arxiv.org/pdf/2506.08972,Atomic-to-Compositional Generalization for Mobile Agents with A New Benchmark and Scheduling System,"Yuan Guo, Tingjia Miao, Zheng Wu, Pengzhou Cheng, Ming Zhou, Zhuosheng Zhang","Autonomous agents powered by multimodal largelanguagemodels have been developed to facilitate task execution on mobile devices. However, prior work has predominantly focused on atomic tasks -- such as shot-chain execution tasks and single-screen grounding tasks -- while overlooking the generalization to compositional tasks, which are indispensable for real-world applications. This work introduces UI-NEXUS, a comprehensive benchmark designed to evaluate mobile agents on three categories of compositional operations: Simple Concatenation, Context Transition, and Deep Dive. UI-NEXUS supports interactive evaluation in 20 fully controllable local utility app environments, as well as 30 online Chinese and English service apps. It comprises 100 interactive task templates with an average optimal step count of 14.05. Experimental results across a range of mobile agents with agentic workflow or agent-as-a-model show that UI-NEXUS presents significant challenges. Specifically, existing agents generally struggle to balance performance and efficiency, exhibiting representative failure modes such as under-execution, over-execution, and attention drift, causing visible atomic-to-compositional generalization gap. Inspired by these findings, we propose AGENT-NEXUS, a lightweight and efficient scheduling system to tackle compositional mobile tasks. AGENT-NEXUS extrapolates the abilities of existing mobile agents by dynamically decomposing long-horizon tasks to a series of self-contained atomic subtasks. AGENT-NEXUS achieves 24% to 40% task success rate improvement for existing mobile agents on compositional operation tasks within the UI-NEXUS benchmark without significantly sacrificing inference overhead. The demo video, dataset, and code are available on the project page at https://ui-nexus.github.io.","Submitted 10 June, 2025; originally announced June 2025."
https://arxiv.org/abs/2506.08933,https://arxiv.org/pdf/2506.08933,What Limits Virtual Agent Application? OmniBench: A Scalable Multi-Dimensional Benchmark for Essential Virtual Agent Capabilities,"Wendong Bu, Yang Wu, Qifan Yu, Minghe Gao, Bingchen Miao, Zhenkui Zhang, Kaihang Pan, Yunfei Li, Mengze Li, Wei Ji, Juncheng Li, Siliang Tang, Yueting Zhuang","As multimodal largelanguagemodels (MLLMs) advance, MLLM-based virtual agents have demonstrated remarkable performance. However, existing benchmarks face significant limitations, including uncontrollable task complexity, extensive manual annotation with limited scenarios, and a lack of multidimensional evaluation. In response to these challenges, we introduce OmniBench, a self-generating, cross-platform, graph-based benchmark with an automated pipeline for synthesizing tasks of controllable complexity through subtask composition. To evaluate the diverse capabilities of virtual agents on the graph, we further present OmniEval, a multidimensional evaluation framework that includes subtask-level evaluation, graph-based metrics, and comprehensive tests across 10 capabilities. Our synthesized dataset contains 36k graph-structured tasks across 20 scenarios, achieving a 91\% human acceptance rate. Training on our graph-structured data shows that it can more efficiently guide agents compared to manually annotated data. We conduct multidimensional evaluations for various open-source and closed-source models, revealing their performance across various capabilities and paving the way for future advancements. Our project is available at https://omni-bench.github.io/.","Submitted 10 June, 2025; originally announced June 2025."
https://arxiv.org/abs/2506.08837,https://arxiv.org/pdf/2506.08837,Design Patterns for Securing LLM Agents against Prompt Injections,"Luca Beurer-Kellner, Beat Buesser Ana-Maria Creţu, Edoardo Debenedetti, Daniel Dobos, Daniel Fabian, Marc Fischer, David Froelicher, Kathrin Grosse, Daniel Naeff, Ezinwanne Ozoani, Andrew Paverd, Florian Tramèr, Václav Volhejn","As AI agents powered by LargeLanguageModels (LLMs) become increasingly versatile and capable of addressing a broad spectrum of tasks, ensuring their security has become a critical challenge. Among the most pressing threats are prompt injection attacks, which exploit the agent's resilience on natural language inputs -- an especially dangerous threat when agents are granted tool access or handle sensitive information. In this work, we propose a set of principled design patterns for building AI agents with provable resistance to prompt injection. We systematically analyze these patterns, discuss their trade-offs in terms of utility and security, and illustrate their real-world applicability through a series of case studies.","Submitted 11 June, 2025; v1 submitted 10 June, 2025; originally announced June 2025."
https://arxiv.org/abs/2506.08800,https://arxiv.org/pdf/2506.08800,Measuring Data Science Automation: A Survey of Evaluation Tools for AI Assistants and Agents,"Irene Testini, José Hernández-Orallo, Lorenzo Pacchiardi","Data science aims to extract insights from data to support decision-making processes. Recently, LargeLanguageModels (LLMs) are increasingly used as assistants for data science, by suggesting ideas, techniques and small code snippets, or for the interpretation of results and reporting. Proper automation of some data-science activities is now promised by the rise of LLM agents, i.e., AI systems powered by an LLM equipped with additional affordances--such as code execution and knowledge bases--that can perform self-directed actions and interact with digital environments. In this paper, we survey the evaluation of LLM assistants and agents for data science. We find (1) a dominant focus on a small subset of goal-oriented activities, largely ignoring data management and exploratory activities; (2) a concentration on pure assistance or fully autonomous agents, without considering intermediate levels of human-AI collaboration; and (3) an emphasis on human substitution, therefore neglecting the possibility of higher levels of automation thanks to task transformation.","Submitted 10 June, 2025; originally announced June 2025."
https://arxiv.org/abs/2506.08726,https://arxiv.org/pdf/2506.08726,Improved LLM Agents for Financial Document Question Answering,"Nelvin Tan, Zian Seng, Liang Zhang, Yu-Ching Shih, Dong Yang, Amol Salunkhe","Largelanguagemodels (LLMs) have shown impressive capabilities on numerous natural language processing tasks. However, LLMs still struggle with numerical question answering for financial documents that include tabular and textual data. Recent works have showed the effectiveness of critic agents (i.e., self-correction) for this task given oracle labels. Building upon this framework, this paper examines the effectiveness of the traditional critic agent when oracle labels are not available, and show, through experiments, that this critic agent's performance deteriorates in this scenario. With this in mind, we present an improved critic agent, along with the calculator agent which outperforms the previous state-of-the-art approach (program-of-thought) and is safer. Furthermore, we investigate how our agents interact with each other, and how this interaction affects their performance.","Submitted 10 June, 2025; originally announced June 2025."
https://arxiv.org/abs/2506.08507,https://arxiv.org/pdf/2506.08507,MasHost Builds It All: Autonomous Multi-Agent System Directed by Reinforcement Learning,"Kuo Yang, Xingjie Yang, Linhui Yu, Qing Xu, Yan Fang, Xu Wang, Zhengyang Zhou, Yang Wang","LargeLanguageModel (LLM)-driven Multi-agent systems (Mas) have recently emerged as a powerful paradigm for tackling complex real-world tasks. However, existing Mas construction methods typically rely on manually crafted interaction mechanisms or heuristic rules, introducing human biases and constraining the autonomous ability. Even with recent advances in adaptive Mas construction, existing systems largely remain within the paradigm of semi-autonomous patterns. In this work, we propose MasHost, a Reinforcement Learning (RL)-based framework for autonomous and query-adaptive Mas design. By formulating Mas construction as a graph search problem, our proposed MasHost jointly samples agent roles and their interactions through a unified probabilistic sampling mechanism. Beyond the accuracy and efficiency objectives pursued in prior works, we introduce component rationality as an additional and novel design principle in Mas. To achieve this multi-objective optimization, we propose Hierarchical Relative Policy Optimization (HRPO), a novel RL strategy that collaboratively integrates group-relative advantages and action-wise rewards. To our knowledge, our proposed MasHost is the first RL-driven framework for autonomous Mas graph construction. Extensive experiments on six benchmarks demonstrate that MasHost consistently outperforms most competitive baselines, validating its effectiveness, efficiency, and structure rationality.","Submitted 12 June, 2025; v1 submitted 10 June, 2025; originally announced June 2025."
